{
  "schema": "autopilot.decisions-sidecar/1",
  "scope": {
    "project_key": "51de403da82a23f0",
    "repo_identity": "git-common-dir:/home/cookys/projects/gate-sandbox/.git",
    "root_run_id": "job-1791517098-eb0aaccd"
  },
  "rows": [],
  "count": 0,
  "irreversible_count": 0,
  "writers_wired": [
    "engine",
    "next-pick"
  ],
  "undocumented_dispatches": 0,
  "ladder": null
}
