{
  "schema": "autopilot.decisions-sidecar/1",
  "scope": {
    "project_key": "51de403da82a23f0",
    "repo_identity": "git-common-dir:/home/cookys/projects/gate-sandbox/.git",
    "root_run_id": "campaign-v1-4cd8f5051b73768393507158211986ae14fb6c21cb6f400fd965b2d952df0acc"
  },
  "rows": [],
  "count": 0,
  "irreversible_count": 0,
  "writers_wired": [
    "engine",
    "next-pick"
  ],
  "undocumented_dispatches": 0,
  "ladder": null
}
